,语料ID,产品名称,内容,年份
516,酒店评论-1517,麗枫酒店(茂名电白万达广场店),丽枫酒店的口碑一直都不错，这次到茂名出游看见丽枫就订了，房间很干净，床单被套洗手间各处细节的卫生都经得起考验，旁边就是万达，逛街方便，但是酒店里面还是很安静的，不影响睡眠。可能是新装修的关系，有点点味道,2020
517,酒店评论-1518,茂名君怡酒店,物有所值哈哈,2020
518,酒店评论-1519,茂名观海楼假日酒店,酒店的招牌很大，位置容易找，一进景区路口就看见了。br酒店后面有停车位，还有两栋未开发完善的酒店楼坯。br酒店正门对着海边，离海滩也很近，景区内吃喝用的都有，挺方便的。br酒店房间不同的价格，不同的方位，面向海滩的偏贵，面向停车场的就便宜点。br酒店设施还齐全，不算陈旧，就是空调的声音很大，应该是风速大引发的，还有就是床套、被子总感觉有很细腻的沙子，洗手间内的梳妆台地面没有排水口，地面有水时，排不走，所以在冲凉间内洗澡，尽量不要把水洒出冲凉间。,2020
519,酒店评论-1520,茂名君悦商务酒店,只能说一分钱一分货,2020
520,酒店评论-1521,高州简尚精品酒店,酒店新净，卫生也清洁,2020
521,酒店评论-1522,好莱登商务宾馆(信宜绍秀体育馆店),就是个一般酒店，路过住一晚，性价比较高！,2020
522,酒店评论-1523,茂名观海楼假日酒店,酒店大堂很气派，前台美女服务热情，房间卫生整洁。门口就是海边，在房间换好衣服直接下去游泳，吃喝玩乐都很方便，家人玩得很开心。下次过来还选这家,2020
523,酒店评论-1524,化州铭丰假日酒店,五星好评！,2020
524,酒店评论-1525,茂名荔晶大酒店,停车方便，服务态度很好,2020
525,酒店评论-1526,茂名君怡酒店,虽没有早餐，但入住后会送两瓶牛奶，卫生服务很好,2020
526,酒店评论-1527,茂名诚荟酒店,停车方便，卫生很好，有淡淡的清香味，房间空间也很大，设备很齐全，满意的一次住宿,2020
527,酒店评论-1528,茂名海豚酒店,感觉不错，有免费矿泉水，剃须刀都有，纸巾充足，卫生搞的不错，毛巾都是消毒的了，，，，，，，，，总之挺满意的,2020
528,酒店评论-1529,尚客优连锁酒店(茂名高铁火车站店),整体很好，但是有几个小地方可以改进一下 1、洗手台比较低，洗手水容易撒出来 2、隔音不太好，晚上会被旁边影响 3、晾衣服的钩子可以相隔更加远一点 4、空调对着头吹，比较冷，床能移到旁边就好了,2020
529,酒店评论-1530,茂名红金鼎商务宾馆,性价比很高的商务酒店，住了一次很满意,2020
530,酒店评论-1531,柏曼酒店(茂名油城七路店),送了一份早餐，早餐很丰富。一年360天都在出差，酒店最重要的是卫生服务，这一家酒店两样达标。来这边出差落脚点就是这了。性价比高，服务好，客房卫生干净舒适。值得推荐！,2020
531,酒店评论-1532,星悦酒店(茂名文化广场店),还不错，停车位较少,2020
532,酒店评论-1533,Q加·茂名大喜假日酒店,有矿泉水免费送，前台很有礼貌热情服务，性价比超高,2020
533,酒店评论-1534,Q加·茂名大喜假日酒店,酒店在新湖二路大道上，附近酒店都比较多，距离市中心商业街直线距离1公里左右，距离市区人工湖公园也就直线距离600米的样子，楼下是便利店，走1分钟就是早餐店。房间还不错，干净卫生。住着也舒服。,2020
534,酒店评论-1535,Q加·茂名大喜假日酒店,已经连续住了几天了，性价比还是挺高的，房间干净卫生，又够大，虽然预定的是双人房，但价格并不贵。楼下就是便利店，需要买东西也方便，睡了几晚，晚上没觉得很吵。,2020
535,酒店评论-1536,Q加·茂名大喜假日酒店,住了5天了，对于经常出差在外住宿来说，很满意。房间够大，干净卫生，睡着也安静，不是很吵。酒店前台的服务态度也很不错，点赞，继续加油！下次出差如果性价比还是那么高，还会选择。,2020
536,酒店评论-1537,茂名熹龙国际大酒店,酒店很高档，环境优美。虽然房间小了点但是装修很高端。酒店的服务态度非常好，每个员工都特别热和卫生阿姨都不错，前台美女送了下午茶卷，还有水果,2020
537,酒店评论-1538,凯里亚德酒店(茂名电白万达广场店),前台服务非常热情！不过必须吐槽下，因自驾海南，加上本人浅睡眠，房间能够安静点，可是住的房间当晚楼顶有老鼠啃东西的声音，一晚没休息好。习惯性的好评，希望以后能有所改善吧,2020
538,酒店评论-1539,茂名熹龙国际大酒店,环境优美，地理位置好，交通方便，房间舒适卫生，服务人员很热情，乐于提供各种帮助，早餐丰富。设施很人性化，网络高速信号好，窗外风景好。有特别的开床服务，房间小摆件的设计也很有特色。性价比不错，下次还要入住,2020
539,酒店评论-1540,凯里亚德酒店(茂名高铁站店),还可以，挺好的，干净卫生,2020
540,酒店评论-1541,凯里亚德酒店(茂名电白万达广场店),新开酒店，环境好，卫生干净，客服有礼貌，再出行会再订购,2020
541,酒店评论-1542,凯里亚德酒店(茂名电白万达广场店),酒店新开的环境不错，位置也很好服务也好！,2020
542,酒店评论-1543,精途酒店(茂名高铁火车站店),不错的一间酒店，一般回来都住这里。服务员态度很好，服务周到，卫生干净，住的舒服。值得推荐,2020
543,酒店评论-1544,茂名蓝海洋酒店,价格合理，环境优美！服务周到，是个值得选择的好酒店。,2020
544,酒店评论-1545,茂名柏丽酒店,很好，环境不错，就是网上的价格有点贵,2020
545,酒店评论-1546,茂名海云雁酒店,酒店环境优美，卫生干净，服务又好，前台经理细心又体贴，关键长得又好看，下次还要来,2020
546,酒店评论-1547,茂名诚荟酒店,出差经常住这里，位于市中心城区，周边有吃有喝有玩，酒店房间很大还有浴缸，有停车场，早餐也不错，酒店服务很好,2020
547,酒店评论-1548,柏曼酒店(茂名大道东汇城店),房间很好，摆放东西的台面多，各项设施也方便，干净好用，有停车场。就是酒店没有餐厅，没有便利店，附近没什么吃饭的地方，要走远点才有商城,2020
548,酒店评论-1549,Q加·茂名大喜假日酒店,性价比很高，卫生干净，有免费停车场，地理位置很方便，下次来出差继续住这里！,2020
549,酒店评论-1550,茂名万达广场雅斯特国际酒店,挺好啊前台接待挺好的,2020
550,酒店评论-1551,精途酒店(茂名高铁火车站店),环境卫生很好,2020
551,酒店评论-1552,凯里亚德酒店(茂名电白万达广场店),挺不错的还送了面包牛奶,2020
552,酒店评论-1553,城市便捷酒店(茂名学府店),性价比超高,2020
553,酒店评论-1554,麗枫酒店(茂名电白万达广场店),这次因为疫情关系，好多酒店没能入住，最后选了这里，非常好的一次体验。酒店很新，设备也很新。几乎给分,2020
554,酒店评论-1555,IU酒店(茂名人民南路油城大厦店),位置优越，对面有个体育馆早上晚上都可以散步，位置就在信宜市迎大道（体育馆店）兰欧酒店，有停车场，前台小姐姐服务好，有笑容，下次还会来住,2020
555,酒店评论-1556,精途酒店(茂名高铁火车站店),酒店有时候会给客人赠送早餐券，虽然早餐种类不多，但是也算是一项加分服务，整体酒店还好，通透性好的房间一般都会住的舒服一些,2020
556,酒店评论-1557,卓越酒店(茂名万达广场店),好评不错很好,2020
557,酒店评论-1558,茂名途遇精品酒店,出差应酬，比较晚了，已经过了凌晨，直接在携程预订了一个房间、入住时发现时间订错了房间，前台很耐心的帮我改时间，免费给我升级了房型、酒店房间也很干净，没有异味，总体体验非常棒。,2020
558,酒店评论-1559,茂名栈泉酒店,早餐挺好的，房间干净,2020
559,酒店评论-1560,茂名诚荟酒店,这个酒店很可以，,2020
560,酒店评论-1561,茂名华燕宾馆,位置地段较好，交通也很方便，已经来住了好几次了，也是我经常住的一家，总体来说还行吧，符合我的需求!!!,2020
561,酒店评论-1562,柏曼酒店(茂名油城七路店),订了两晚的柏曼酒店，新装修，干净，服务周到，前台的服务员很耐心，下次有机会再去茂名的话一定会再次入住的。,2020
562,酒店评论-1563,茂名栈泉酒店,酒店真的一般，,2020
563,酒店评论-1564,精途酒店(茂名高铁火车站店),早餐样式不多，价位摆在那里，还过得去，胃口就那么大，吃不了多少，停车场不多，但是每次去都停市场旁边，也还算方便。酒店位置不算偏僻，附近也有一些吃饭的店,2020
564,酒店评论-1565,精途酒店(茂名高铁火车站店),每次都住这里，习惯了，早餐很棒，值得推荐的好酒店！,2020
565,酒店评论-1566,茂名碧海湾酒店,酒店一般的。窗户看看外面的世界没有。只看不够一米的墙。房间有霉味。早餐还可以。停车只能在门口。没有专用停车场,2020
566,酒店评论-1567,信宜丽晶酒店,还不错空调比维也纳的要好,2020
567,酒店评论-1568,维也纳国际酒店(茂名高铁火车站店),环境优美，地理位置好，交通方便，房间舒适卫生，服务人员很热情，乐于提供各种帮助，早餐丰富。设施很人性化，网络高速信号好，窗外风景好。有特别的开床服务，房间小摆件的设计也很有特色。性价比不错，下次还要入,2020
568,酒店评论-1569,麗枫酒店(茂名电白万达广场店),前台服务态度非常好，丽枫酒店是连锁的，我们以前在广州时住了一个星期，卫生和舒适性都挺不错，性价比高，就是洗发水护发素的盖子设计的很不好，不小心弄伤了手，前台也贴心送了创可贴，我记得以前的盖子好像不是这种，希望能改进,2020
569,酒店评论-1570,茂名海豚酒店,有一说一，酒店性价比很高，很不错，唯一不足的是住了两夜，中间没有整理房间，如果去要求的话应该也可以，但是我懒得去，也就算了，希望以后能够改进一下。酒店不是太高级，但是没有可挑剔的地方。总的来说，还是推荐入住的。,2020
570,酒店评论-1571,凯里亚德酒店(茂名电白万达广场店),离万达一两公里，走路到不了的，早餐是有，但不含，因二楼是茶楼，热闹得很。停车方便，新开业，卫生。智能设备有好有坏，想关灯睡觉得傻傻地喊了喊天猫某某，请调睡眠模式，然后睡意全无。,2020
571,酒店评论-1572,茂名华燕宾馆,我是通过网上预定的该酒店房间，提前定好，不会着急下车没地方待。我到酒店后直接报名字就办理入住了，很方便。酒店环境不错，前台服务员态度也好，很热情。让人有宾至如归的感觉， 各种收费很透明，明码标价，不怕被宰。嗯，这次住宿体验不错。如果还来这里，一定还选择这个酒店。给个好评！！,2020
572,酒店评论-1573,茂名熹龙国际大酒店,还可以，来茂名都会选这家酒店，唯一就是之前下午茶都是给当天的可以用，给第二天的都离开酒店了要来有啥用，外地的,2020
573,酒店评论-1574,茂名熹龙国际大酒店,酒店是中式装修，可以免费停车；距离高铁站很近，靠近文创街，后面是人民广场，吃喝玩乐超级方便。入住时前台小姐姐很热情，给升级了豪华园景房，房间很满意。第一天送了小礼品，第二天送了果盘；下午还送了糖水和下午茶券，超nice；不足的是早餐种类少，水压不太稳定。总体是服务很好，卫生干净整洁，下次会再来的一家酒店,2020
574,酒店评论-1575,麗枫酒店(茂名电白万达广场店),酒店斜对面就是万达广场，逛街购物非常方便，我们是从浪漫海岸酒店过来这边万达吃火锅订的酒店，刚开始孩子有些闹腾，毕竟从五星级酒店到这里还是有一点点的落差，不过还好，丽枫酒店卫生方面做的很好，而且服务态度超级好，只有一点我个人觉得可以去改善，就是洗浴用品（洗发水沐浴露）的盖子，真的不好挤,2020
575,酒店评论-1576,茂名君怡酒店,酒店在市中心交通方便，环境很好，酒店周边很多餐厅可以吃饭，客房卫生很干净，前台的小姐姐服务也很热情；酒店二楼还开了个茶市，推荐入住；,2020
576,酒店评论-1577,柏曼酒店(茂名油城七路店),酒店前台很有礼貌，卫生又干净，酒店位置很好，吃喝玩乐附近都有,2020
577,酒店评论-1578,柏曼酒店(茂名大道东汇城店),性价比高，居住环境很好。,2020
578,酒店评论-1579,IU酒店(茂名人民南路油城大厦店),房间里面的设备不错，空调有点滴水，就是外面过道有点味，,2020
579,酒店评论-1580,茂名海豚酒店,酒店设施还可以，位置离第一滩很近，附近挺多小吃店的。,2020
580,酒店评论-1581,凯里亚德酒店(茂名高铁站店),一直住凯里亚德，床很舒服，环境不错，好停车！接待很有礼貌，新店环境很好，不错，位置也比较不错！老会员评价,2020
581,酒店评论-1582,茂名君怡酒店,酒店应该是新开的，房间很干净，服务还不错。如果能有早餐就好了。酒店周边出行，吃饭非常便利，楼下有一个超市，购物便利！,2020
582,酒店评论-1583,化州桔龙商务酒店,前台的姐姐人很好，服务很棒！房间实况和图片一致。,2020
583,酒店评论-1584,凯里亚德酒店(茂名电白万达广场店),非常不错 环境好,2020
584,酒店评论-1585,柏曼酒店(茂名油城七路店),没吃酒店的早餐，房间很好，空间很大，性价比非常高！,2020
585,酒店评论-1586,IU酒店(茂名人民南路油城大厦店),很好，舒服，安静,2020
586,酒店评论-1587,轻住悦享酒店(茂名高铁南站店),酒店在开发区哪里，离市区不是很远，离茂名火车站很近，坐车还行。酒店楼下有共享电瓶自行车，骑行比较方便！,2020
587,酒店评论-1588,凯里亚德酒店(茂名高铁站店),性价比极高，新装修的房间，很喜欢这样现代时尚的装修风格，房间够大。这种单独电视柜的做法有点套房的既视感。房间的设施也很新，质量也高，牙刷、拖鞋的品质都不错，堪比星级宾馆。还有一个记忆棉枕，睡着也很舒服。床垫很舒服，略微偏软，挺适合我的。总之，强烈推荐！绝对值得你入住。,2020
588,酒店评论-1589,精途酒店(茂名高铁火车站店),一如既往地好,2020
589,酒店评论-1590,IU酒店(茂名人民南路油城大厦店),价格实惠很不错的酒店,2020
590,酒店评论-1591,茂名君怡酒店,酒店环境好，靠市中心交通很方便，前台服务好，热情。客房卫生很干净，二楼有茶楼可以喝早晚茶，离万达广场才5分钟的车程。对面还有一家很大书店，女儿就去哪里看书半天。,2020
591,酒店评论-1592,茂名东诚智能公寓,感觉好有时尚感，没想到在这么小的空间可以享受到整套的智能化设备。,2020
592,酒店评论-1593,凯里亚德酒店(茂名高铁站店),很好的一家店，服务态度满分，还有早餐送，环境也可以，有免费停车场，附近就是茂名人民医院,2020
593,酒店评论-1594,茂名君怡酒店,早餐可以在2楼餐厅订，可以送上房间。房间挺大的，位置在镇中心，导航过去挺方便，旁边和对面都有美食。门口有地方停车，还有地下停车场！是不错的选择！,2020
594,酒店评论-1595,麗枫酒店(茂名电白万达广场店),本人是比较喜欢温馨安静的气氛，这家酒店就很合我胃口，一进到酒店气氛很好，音乐也很温馨，环境以及灯光给我的感觉挺暖的，酒店服务也很好，我进到酒店大堂刚坐下就有前台的工作人员递来一杯茶跟一条热毛巾，房间的话可能是新酒店的原因施舍设备都很新，酒店很满意。,2020
595,酒店评论-1596,茂名荔晶大酒店,服务好，就是地下停车场乌漆嘛黑，指示标识不清，手机信号还不好,2020
596,酒店评论-1597,精途酒店(茂名高铁火车站店),环境很好，出行方便,2020
597,酒店评论-1598,茂名诚荟酒店,可以的房间挺好,2020
598,酒店评论-1599,凯里亚德酒店(茂名高铁站店),干净舒适，停车方便，大堂经理，前台小妹，搞卫生阿姨，服务热情。滨海绿城，好心茂名，荔枝红艳，龙眼清甜，神清气爽，回味无穷。,2020
599,酒店评论-1600,麗枫酒店(茂名电白万达广场店),停车场很大，后面也有，大厅很大，就是没有空调，很热了。前台工作人员热情，楼层服务员也很热情。对面就是万达广场,2020
600,酒店评论-1601,茂名君怡酒店,酒店房间不错，前台服务也好，下来还有茶水喝,2020
601,酒店评论-1602,茂名市便捷酒店(高铁火车站店),这里的服务真的很好，从前台到服务员，每个人都很热情好客，笑容满面。价钱很经济实惠，地理位置又很方便。大家过来还是要去住新装修的客房。我是贪便宜不差就行了。这里刚好能满足我的需求，下次还会再过来。推荐大家过来入住。,2020
602,酒店评论-1603,凯里亚德酒店(茂名高铁站店),很晚才到酒店入住前台服务也挺好 去的时候地下停车位满了 停不了几辆 前台安排后院的停车位 入住整体都挺好,2020
603,酒店评论-1604,柏曼酒店(茂名大道东汇城店),超级喜欢这里。房间比想象中的大，干净卫生，隔音又好，睡着安心。不远处就是东汇城，找吃的也方便。,2020
604,酒店评论-1605,茂名红天旅馆,酒店房间隔音效果真心不错，比效安静，不会受房间外的声音影响。酒店相当不错，周围同等价的格酒店一对比，此店确实性价比高 ，物有所值。,2020
605,酒店评论-1606,茂名观海楼假日酒店,海景房正对一线海景，虽然比旁边的海云雁少了泳池，但后面出门直接出到沙滩，而且就到可以游泳的区域，很方便。热水出得有点慢，但水很猛，冲沙很爽。虽然没带早餐，但楼下吃的还是有的，晚餐其实在右边旁边那家吃也不错，有套餐，自己点鱼虾蟹，很实在，没有乱七八糟的加收。建议还可以去水东的东湖附近饮个早茶，好多会加点海味，比如蚝仔瘦肉粥，比如海味干蒸，还有各色坂。但建议要问有无提前订位，尤其周末人超多。夜晚也可以又再去红树林栈道，据说开灯很漂亮。但我们因为下雨没去成。,2020
606,酒店评论-1607,城市便捷酒店(茂名学府店),我是去考试的，离学校确实很近，中午还可以走路回酒店午睡休息，中规中矩，不算很好，也没有很差吧。对了，我写这个评论时已被录取，希望接下来的考生也加油！,2020
607,酒店评论-1608,麗枫酒店(茂名电白万达广场店),酒店位置挺好的，斜对面就是万达广场，完全可以步行前往。卫生和服务都不错，还有足够的免费停车位，非常方便。,2020
608,酒店评论-1609,茂名国际大酒店,很棒一次旅途，各方面都很好，下次还会入住,2020
609,酒店评论-1610,凯里亚德酒店(茂名高铁站店),配套很好，空调风口对着床的方向做了遮挡，很人性化的设计。缺点价格有点高，而且没早餐，附近吃饭地方少。,2020
610,酒店评论-1611,Q加·茂名大喜假日酒店,出差经常来,2020
611,酒店评论-1612,茂名熹龙国际大酒店,性价比超高的酒店，服务十分到位，非常满足，强推荐！ 本来预定部留的是13楼，前台知道我想高层的，就换了一个17楼的，视野超好！ 本来订单不含早餐，后来又送了早餐券和下午茶券（可以去行政酒廊品尝），下午茶回来发现又送了水果和糖水，赞！ 半夜喝水弄湿床单，又安排人过来换床单，服务到位！ 物超所值！,2020
612,酒店评论-1613,麗枫酒店(茂名电白万达广场店),第一次体验丽枫酒店，到门口的时候震惊到了，地理位置超好，（旁边就是万达广场）停车场很宽敞，门口看着就很豪华，（以后招待朋友首选丽枫酒店，绝不丢脸）进去大堂空调也很给力，办理入住很快，前台接待很热情，也很细心（落了东西在前台很细心的提醒我）客房大姐也很有礼貌，房间干净又卫生，设施齐全而且新颖，早餐还是直接配送到房间的，住这么多酒店第一次有这么好的入住体验，简直是太棒了,2020
613,酒店评论-1614,茂名海豚酒店,离海滩不算太远，酒店停车方便，房间整洁，设施完善，性价比较高,2020
614,酒店评论-1615,茂名熹龙国际大酒店,酒店地理位置很好 ，硬件软件都不错，性价比很高。这次的房间正对着人民公园，风景很好，周边也有很多餐饮店。商务休闲都合适,2020
615,酒店评论-1616,茂名观海楼假日酒店,来过很多次l，仍然会选择这个酒店，因为真的很方便，楼下就是沙滩.而且看海景的房间也特别好。后面就是冰雪乐园，周边的设施都很完善。沙滩很广阔，舒服，好玩。几乎每年都来,2020
616,酒店评论-1617,茂名观海楼假日酒店,设施就是有点陈旧，服务态度很好，环境也好离海边很近。,2020
617,酒店评论-1618,茂名诚荟酒店,酒店是相当不错的，与周围同等价格酒店对比，此店性价比高 ，物有所值。酒店房间隔音效果还是不错，效安静，房间外走廊说话声音听不到的。,2020
618,酒店评论-1619,茂名熹龙国际大酒店,大堂经理服务真周到，给升级套房 超级棒,2020
619,酒店评论-1620,茂名海豚酒店,挺好，环境卫生都OK,2020
620,酒店评论-1621,维也纳国际酒店(茂名万达广场店),一直喜欢住，简约舒适,2020
621,酒店评论-1622,Q加·茂名大喜假日酒店,很超值的一次体验！！订的双人床房前台美女免费给升级豪华1.8米双床房！！超赞，，房间干净送矿泉水！热水够猛WiFi给力！！楼下停车方便可开票！！,2020
622,酒店评论-1623,柏曼酒店(茂名大道东汇城店),装修不错，停车场车位多，方便停车。房间卫生也不错。就是酒店旁边没有吃饭的地方，需要去附近找，这点不太方便。,2020
623,酒店评论-1624,茂名海豚酒店,服务态度好，干净整洁，交通便利，空调效果好，性价比高。,2020
624,酒店评论-1625,柏曼酒店(茂名大道东汇城店),再次订的大床房间在二楼，隐私性不太好窗户是百叶窗还紧贴着隔壁的楼，洗澡间下水道不知为何总有一股难闻的气味。房间的卫生和设施还算不错。有大型停车场，停车很方便。,2020
625,酒店评论-1626,凯里亚德酒店(茂名高铁站店),非常棒的酒店，入住体验非常好，前台服务非常棒，周边设施配套齐全，地段繁华，住着非常方便舒适，真心赞。,2020
626,酒店评论-1627,茂名海豚酒店,已经第二次入住，酒店地理位置好，就在停车入口边。房间宽敞明亮，卫生。床铺够宽，枕头非常柔软舒服，全五星好评！,2020
627,酒店评论-1628,茂名诚荟酒店,空调不给力,2020
628,酒店评论-1629,轻住悦享酒店(茂名高铁南站店),"前台小姐姐服务态度超级赞滴,很细心!房间进去第 一眼看到很舒服,床也很软,很舒服。卫生好,环境 好,服务周到!还会再来的!",2020
629,酒店评论-1630,轻住悦享酒店(茂名高铁南站店),一个月去三到四次茂名，都是住在这，已经很有熟悉感了，环境好、也挺干净的，只主要有早餐吃，还挺好吃的。下个月还得去住多两次,2020
630,酒店评论-1631,茂名熹龙国际大酒店,酒店位置十分优越，旁边是人民公园，对面是步行街，有口碑很好的特色老店，电影院，小吃糖水店，按摩店都是一步之遥。 必须点赞酒店的服务，前台人员和碰到的工作人员都很热情。面带微笑问好，全程入住退房都很迅速，经要求还顺利升级了园景房。 另外，细节很加分就是，插头是使用能够接入国际标准的插板。升级的房型配置了电脑。我还玩了好一会愤怒的小鸟。 美中不足的有两条，一个是浴室非常大，导致了房间空间感觉有限。二是配置相对落后陈旧需要升级，晚上可能电压不稳，室内的灯微闪了几次。此外，能听到隔壁，楼上还有过道的少许噪音。还有就是浴室的花洒款式太老了，变更淋浴方式居然靠人手艰难扭动希望有条件可以升级个科勒才对得起五星级的配置。,2020
631,酒店评论-1632,柏曼酒店(茂名大道东汇城店),位置很好找！也挺舒适！就是不喜欢电视接收遥控那个感应灯，关了房间灯睡觉那个感应灯贼亮有点光污染，影响入睡费好大功夫才用东西把它遮住,2020
