,语料ID,产品名称,内容,年份
747,酒店评论-1748,维也纳国际酒店(茂名万达广场店),首先前台太不专业了，我是归国华侨持中国护照，前台小姐直接说你不能入住，因为要扫描身份证所以护照不行。我说你不懂可以问经理嘛，哪能拒绝客人呢？……。,2020
748,酒店评论-1749,IU酒店(茂名人民南路油城大厦店),住的挺舒服，每次来茂名都住这里，每个房间都有窗户，通风良好，无异味，卫生打扫的也很干净，床上品干净 舒服，浴室干净 整洁，牙具及一次性用品质量好，酒店前台小刘很热情 ，方便便捷，价格不贵，酒店房间很大，宽敞，住起来舒服自在，网络流畅用起来很舒服，工作人员也热情，服务意识很强，隔音也还不错， 其他设施都比较齐全，房间卫生也挺干净，通风良好无异味，离得公交站也比较近，周边吃吃喝喝都有，价格也不贵，性价比蛮不错， 值得推荐的一家酒店。,2020
749,酒店评论-1750,维也纳国际酒店(茂名万达广场店),服务好，环境优美，地置好好,2020
750,酒店评论-1751,茂名泊愉青年公寓,环境好，服务好，卫生干净,2020
751,酒店评论-1752,柏曼酒店(茂名油城七路店),很好平安夜赠送小礼品，感恩！价格实惠，地理位置优越，房间也不错，干净卫生，前台服务超级好,2020
752,酒店评论-1753,麗枫酒店(茂名电白万达广场店),服务热情，态度好,2020
753,酒店评论-1754,轻住悦享酒店(茂名高铁南站店),非常好前台服务好房间大早歺好吃下次来,2020
754,酒店评论-1755,精途酒店(茂名高铁火车站店),可以，房间很大，设施也很好，服务人员态度也很好，就是有一边是靠近路边的，晚上睡觉可能会有车声,2020
755,酒店评论-1756,轻住悦享酒店(茂名高铁南站店),环境不错，服务比较好,2020
756,酒店评论-1757,茂名御景国际大酒店,酒店房间很大，高层住的好舒服，开车过来，地方好找，交通方便，停车也方便。早餐，款式多样。性价比高，值得推荐。,2020
757,酒店评论-1758,茂名御景国际大酒店,酒店前台服务热情，行李生会帮忙拿行李，何南经理会介绍酒店，位置方便，早餐丰富，周边商场餐饮配套成熟，有停车场，房间面积大，装修新，淋浴很舒服，床垫枕头都很舒适。现在住店很优惠呢。,2020
758,酒店评论-1759,茂名御景国际大酒店,酒店高大上，外墙全玻璃幕墙很漂亮，房间内很清洁，人性化设计，布局合理，自助餐丰盛，服务好，下次过来一定选御景国际大酒店住。,2021
759,酒店评论-1760,茂名御景国际大酒店,酒店房间大，大堂很气派，人性化设计，自助餐很丰盛，服务员都很有礼貌，现在过来住很划算，建议大家可以来体验一下。,2021
760,酒店评论-1761,麗枫酒店(茂名电白万达广场店),服务很好 环境也好,2021
761,酒店评论-1762,麗枫酒店(茂名电白万达广场店),喜欢酒店推荐这家店很好,2021
762,酒店评论-1763,轻住悦享酒店(茂名高铁南站店),态度好，卫生好，服务好，房间超大，早餐丰富多样，很满意,2021
763,酒店评论-1764,城市便捷酒店(茂名学府店),酒店不错，挺干净的，光线也很好，唯一的缺点就是稍微有点小了酒店不错，挺干净的，光线也很好，唯一的缺点就是稍微有点小了,2021
764,酒店评论-1765,茂名荔晶大酒店,地理位置不错，停车方便,2021
765,酒店评论-1766,麗枫酒店(茂名电白万达广场店),服务很好网络很好他推荐酒店,2021
766,酒店评论-1767,柏曼酒店(茂名油城七路店),交通便利 服务还是很好！亲切热情招呼， 连保安都会跟你问好 有免费的停车场，停车场位置还挺大，感觉挺不错 房间挺干净，有浴巾，房间也不会有异味，床大住的十分舒服,2021
767,酒店评论-1768,麗枫酒店(茂名电白万达广场店),很好 很不错的 满意推荐酒店,2021
768,酒店评论-1769,麗枫酒店(茂名电白万达广场店),停车方便，住的舒服。,2021
769,酒店评论-1770,城市便捷酒店(茂名水东万达广场区政府店),酒店装饰很漂亮。前台服务态度很好。楼层阿姨服务也很好。还有自助餐挺好吃的。离万达广场特别近，还有停车场,2021
770,酒店评论-1771,麗枫酒店(茂名电白万达广场店),很好 位置优越 经常来 推荐这家酒店,2021
771,酒店评论-1772,麗枫酒店(茂名电白万达广场店),出差首选酒店很好很干净位置很好,2021
772,酒店评论-1773,麗枫酒店(茂名电白万达广场店),很好很满意 酒店首选 服务一流,2021
773,酒店评论-1774,Q加·茂名大喜假日酒店,酒店卫生很干净，房间宽大，床和被子很舒服，前台服务周到，整体来说很不错值得推荐，以后出差当地定点酒店。非常棒！,2021
774,酒店评论-1775,城市便捷酒店(茂名滨海新区电城店),有地下车库，酒店是新的，真的卫生讲究，刷牙和喝水的杯子都是用塑料密封的一次性杯子，布局温馨，前台小姐姐态度好，好看,2021
775,酒店评论-1776,轻住悦享酒店(茂名高铁南站店),发非常好服务很好早餐非常好吃丰富,2021
776,酒店评论-1777,维也纳3好酒店(茂名沿江大厦店),舒服干净整洁舒适,2021
777,酒店评论-1778,麗枫酒店(茂名电白万达广场店),环境不错的，挺好的。前台小姐姐人美声甜服务好,2021
778,酒店评论-1779,茂名荔晶大酒店,酒店设施干净，房间宽敞明亮。前台接待热情。早餐丰富，停车方便，性价比高。,2021
779,酒店评论-1780,麗枫酒店(茂名电白万达广场店),很好，服务好，交通方面特别好，环境特别好。,2021
780,酒店评论-1781,茂名化州丽登酒店,位置优越、服务优秀、卫生干净,2021
781,酒店评论-1782,麗枫酒店(茂名电白万达广场店),非常不错的,2021
782,酒店评论-1783,茂名熹龙国际大酒店,服务极好，可以预定接送站。 会提前通知等待的地方，一出站就帮我提行李箱，然后下车又有人给我接着提着，一直送到客房服务真的很到位 送站也是一样，还会问我们渴不渴，给我们水和湿巾。 早餐自助餐菜式很丰富，吃得饱饱哒 刚住进去就送了一份水果，第二天又送了一份， 我朋友结婚订的房间要熨斗烫衣服，直接送了两个不同样式的上来 最重要是便宜划算，比上次住5星际酒店还好,2021
783,酒店评论-1784,茂名君怡酒店,早餐的品种多，味道也很好，前台的小姐姐个个都很漂亮很热情，服务员也很有礼貌，感觉在这里住，很有家的感觉，下次还会再来。,2021
784,酒店评论-1785,茂名熹龙国际大酒店,很好的酒店，我们提前到了办理入住，房间没有准备好，送了下午茶让我们等候，房间设施不错，早餐也不错，有免费停车场。,2021
785,酒店评论-1786,茂名市便捷酒店(高铁火车站店),酒店位置不错，就在高铁站附近，最主要是价格便宜经济床很大很舒服，房间很干净阿姨每天都会及时打扫，晚上也很安静，前台服务态度也很好，值得推荐给大家。,2021
786,酒店评论-1787,茂名君怡酒店,路过电白区住一晚，交通便利的酒店，还有一个地下停车场，很好。 海景房真能远远看见海浪，不错。 周围吃饭选择多，鸭子粥好吃，有意思,2021
787,酒店评论-1788,麗枫酒店(茂名电白万达广场店),经常入住这家酒店 一如既往的好,2021
788,酒店评论-1789,茂名星城湾国际酒店,镇子上有这么好的酒店，真是没想到。入住体验可以用“惊喜”来形容。新酒店，免费升级了豪华双人间，非常感谢。设施特别好，洗澡的花洒很大，电吹风超级给力。前天非常热情，面带微笑，温暖如春。全五分。下面有一个大超市，买东西很方便。,2021
789,酒店评论-1790,城市便捷酒店(茂名学府店),环境好服务好交通方便,2021
790,酒店评论-1791,茂名永利之家,位置挺方便的,2021
791,酒店评论-1792,茂名万达广场雅斯特国际酒店,车位好多，服务不错,2021
792,酒店评论-1793,城市便捷酒店(茂名滨海新区电城店),酒店附近还是比较热闹的很方便，就是晚上附近闹市稍微吵一点,2021
793,酒店评论-1794,轻住悦享酒店(茂名高铁南站店),非常喜欢这个酒店下次过来房间很大早餐好吃,2021
794,酒店评论-1795,茂名栈泉酒店,早餐丰富，有停车场。,2021
795,酒店评论-1796,化州桐趣电影游戏主题酒店,酒店装修很不错，设备设施新，一楼有很宽敞的休闲区，住得舒适，推荐。,2021
796,酒店评论-1797,茂名观海楼假日酒店,有早餐的餐厅，但我们没去吃，我们来到是闲时。离海边很近，这个位置很好，一家四口都舒服。晚上十点也可在海边吹吹风，很好。酒店提供了免费停车场，外出记得去前台要个二维码停车票。很适合带小朋友入住！安全好玩。,2021
797,酒店评论-1798,茂名星城湾国际酒店,酒店住的舒服，装修风格时尚，房间够大，温馨，交通方便,2021
798,酒店评论-1799,茂名熹龙国际大酒店,十分满意的一次体验，进门小哥一路帮忙拉行李到房间，看到指甲太长又送了指甲套装，房间又免费送了水果、饮料。第二天早餐种类也十分丰富，停车位也比较方便，满分！,2021
799,酒店评论-1800,IU酒店(茂名人民南路油城大厦店),性价比高，房间大小合适，前台短发靓女服务态度很好。,2021
800,酒店评论-1801,凯里亚德酒店(茂名高铁站店),不错，服务态度好，因为有老人，服务员把房间调整了一下，十分感谢，下次有机会再到茂名还是会选择这个酒店,2021
801,酒店评论-1802,茂名君怡酒店,我们前后一共住了4晚，分别体验了在12楼的海景双床房与10楼的海景家庭房，酒店位置非常好，在水东镇的中心地带，去第一滩7、8公里，到红树林步行不到1公里，去海边栈道1公里，二楼就是喝茶的地方，对面就有特色的牛腩粉和捞河粉吃，楼下就是超市。前台服务热情亲切，房间是现代的轻奢装修风格，两种房型房间都非常大，早上能够看到日出，还可以看到远处的海与红树林，海景双床房间有两张1.5米的双床，海景家庭房空间更大，一张1.5米，一张2米大床，非常舒适，适合带孩子的家庭入住。房间内桌椅配套齐全，厕所空间设计合理，使用方便，洗澡水够大，只是海景双床房间少了衣柜，对于住几天的客人有点不方便。12楼清洁阿姨热情主动和客人打招呼，前台小姐姐主动询问客人入住感受体现了人文的关怀。总体感觉比同类型的酒店性价比更高，极力推荐入住，建议厕所门后多安装一些挂勾，沐浴房内加多一条短短的凉衣的不锈钢，方便需要洗衣服滴干水。,2021
802,酒店评论-1803,IU酒店(茂名人民南路油城大厦店),房间很漂亮，喜欢那沙发的颜色，性价比高，过年没涨价，前台湖南靓女服务态度很好。,2021
803,酒店评论-1804,茂名海豚酒店,交通方便，环境好、房间干净,2021
804,酒店评论-1805,轻住悦享酒店(茂名高铁南站店),非常好早餐好前台服务好,2021
805,酒店评论-1806,Q加·茂名大喜假日酒店,酒店位置不错 热水供应也足 就是床有一股臭味 另外建议换一种拖鞋 拖鞋的胶臭味真的太浓了,2021
806,酒店评论-1807,凯里亚德酒店(茂名高铁站店),1.喜欢。 2.早餐不错，品种多。 3.服务态度好，家人觉得很贴心。 4.有停车位。由于市区停车难，我们都是打车来往，距离景点短。,2021
807,酒店评论-1808,茂名海豚酒店,还行，就是隔音还差点。,2021
808,酒店评论-1809,茂名熹龙国际大酒店,酒店的环境、卫生、服务、设施、位置、价格是我住过的酒店中最好的，服务真是好，门口小哥主动帮你拿行里，办理入住，又帮你送到房间，有免费的停车场，位置在市区中心，后是广场，马路对面是商场步行街，早餐又比较丰富，这是我住过的性价比最高，服务最好，设施最豪华的酒店。,2021
809,酒店评论-1810,精途酒店(茂名高铁火车站店),早餐还不错，有停车场，酒店位置在路边好找。,2021
810,酒店评论-1811,茂名国际大酒店,干净卫生，地点好，楼下各种方便，下次还会再来。服务也是非常不错的。厕所干湿分区，这个是我非常满意的地方。,2021
811,酒店评论-1812,麗枫酒店(茂名电白万达广场店),住的舒服，早餐丰富，前台服务态度特别好，有求必应！,2021
812,酒店评论-1813,城市便捷酒店(茂名学府店),附近的环境很安静、附近好多吃的，让在外的人，感受到了归家的感觉：旅馆环境真的很干净，各种设施齐全，这里有温馨如家的环境，前台服务也是很和善态度很好，还有那周到齐全的全天候服务。如果有机会，我还会来这里。 干净干净干净干净干净，重要的事情要说好几遍哦，这是我对这家这家旅馆最大的感触。,2021
813,酒店评论-1814,轻住悦享酒店(茂名高铁南站店),非常棒的一个酒店,2021
814,酒店评论-1815,茂名海豚酒店,环境不错，交通方便。,2021
815,酒店评论-1816,维也纳国际酒店(茂名电白店),酒店所有工作人员的服务态度都很好，还帮忙赠送了早餐，酒店的早餐品种繁多，味道还可以，房间里撒了薯片客房阿姨也非常乐意帮忙清扫，走的时候遗漏了ipad也及时收到酒店前台的来电，帮忙叫顺丰寄了上来，下次回老家还要订这间酒店,2021
816,酒店评论-1817,茂名荔晶大酒店,环境好，卫生服务态度好,2021
817,酒店评论-1818,IU酒店(茂名人民南路油城大厦店),性价比高，房间干净卫生，出行方便，停车方便，前台短发靓女服务态度好，下次还来。,2021
818,酒店评论-1819,茂名熹龙国际大酒店,不过，位置很多，隔壁就是人民广场，对面就是步行街，酒吧街…氛围很棒,2021
819,酒店评论-1820,麗枫酒店(茂名电白万达广场店),服务态度很好很满意,2021
820,酒店评论-1821,维也纳国际酒店(茂名电白店),"如即往的满意!出差茂名电白,一定会选择维也 纳酒店,位置交通便利……服务人员态度不错 次一定会再选择",2021
821,酒店评论-1822,茂名鑫都宾馆,很差劲，空调跟拖拉机似的，吵一夜。床上还有螨虫咬，被子有异味。不是定了不能退，勉强将就。Wifi 还不是每间客房独立，公共Wifi，不安全。连3星都不该上的评分，为什么会有4.1的总评？,2021
822,酒店评论-1823,凯里亚德酒店(茂名高铁站店),1.位置挺好，周边环境不错。楼下便利店餐饮都有。 2.窗户隔音好，房间安静，住着舒服。 3.设备设施都挺好用。 4.装修设计很精致、房间格局好。 5.早餐还行。 6.酒店服务挺好。,2021
823,酒店评论-1824,城市便捷酒店(茂名学府店),还是不错的 但偶尔会有些噪音,2021
824,酒店评论-1825,城市便捷酒店(茂名学府店),还不错，整体来说还不错,2021
825,酒店评论-1826,茂名诚荟酒店,离万达很近，吃饭逛街方便,2021
826,酒店评论-1827,轻住悦享酒店(茂名高铁南站店),停车方便，有早餐价格经济很好,2021
827,酒店评论-1828,凯里亚德酒店(茂名高铁站店),前台服务很棒，房间很大，配套齐全。,2021
828,酒店评论-1829,轻住悦享酒店(茂名高铁南站店),服务很好早餐好吃停车场很大，前台好像亲人一样热情棒棒哒,2021
829,酒店评论-1830,轻住悦享酒店(茂名高铁南站店),非常好早餐好吃服务很好,2021
830,酒店评论-1831,城市便捷酒店(茂名学府店),总体还是可以的，环境不错，我是去考试住的，离学校很近，走路也就十多分钟，房间配套设施还是很齐全的，在酒店中算中上吧！,2021
831,酒店评论-1832,IU酒店(茂名人民南路油城大厦店),高低两个枕头 照顾顾客需要,2021
832,酒店评论-1833,茂名万达广场雅斯特国际酒店,挺方便的，一出门就是大马路,2021
833,酒店评论-1834,茂名熹龙国际大酒店,早餐丰盛、服务周到、设施齐全，水果+水吧+下午茶+宵夜粥……楼外环境很好，人民公园，每次来必住，值得选择。,2021
834,酒店评论-1835,轻住悦享酒店(茂名高铁南站店),非常棒服务很好停车场很大早餐好吃下次还会回来住,2021
835,酒店评论-1836,城市便捷酒店(茂名学府店),紧凑型，过得去吧，住的话靠近马路这边可能会安静睡得好些，靠学校有点吵,2021
836,酒店评论-1837,茂名名晟宾馆,不错的。房间很整洁。,2021
837,酒店评论-1838,麗枫酒店(茂名电白万达广场店),酒店是今年新开的，设施较新也齐备，卫生也不错。酒店对面是万迖广场，购物方便；附近还有美食街，吃饭也方便。酒店门前和后院可停车，方便自驾者；当然离老城区较远。,2021
838,酒店评论-1839,城市便捷酒店(茂名学府店),早餐中规中矩，能带孩子啊。,2021
839,酒店评论-1840,麗枫酒店(茂名电白万达广场店),环境挺好的，走过去电白万达广场5分钟不用，房间设施齐全，干净。早餐是送到房间门口的，而且还不错。就是睡到早上6点多7点的时候不知道楼上还是楼下装修，一直在响，8点左右就没吵了，希望下次再入住没有这种情况了。,2021
840,酒店评论-1841,麗枫酒店(茂名电白万达广场店),前台接待人员热情周到,2021
841,酒店评论-1842,城市便捷酒店(茂名学府店),位置好找，还行,2021
842,酒店评论-1843,茂名柏丽酒店,环境一般，卫生还可以,2021
843,酒店评论-1844,茂名诚荟酒店,什么都好就是隔音差点，隔壁是KTV不好睡觉,2021
844,酒店评论-1845,城市便捷酒店(茂名学府店),连锁的酒店，不错，很干净,2021
845,酒店评论-1846,凯里亚德酒店(茂名电白万达广场店),不错，中间虽然出现了小插曲，前台马上进行了弥补，服务还是很棒的,2021
846,酒店评论-1847,凯里亚德酒店(茂名高铁站店),新开的酒店，用品都很新，前台服务也特别好。房间有烟味，前台小哥哥立马更换了其他房间，处理高效。推荐入住！,2021
847,酒店评论-1848,茂名熹龙国际大酒店,酒店卫生做得挺好！早餐挺丰盛的，也很卫生。服务特别好，细致周到，态度好！行李生特别好特别贴心。愉快的住宿体验,2021
848,酒店评论-1849,Q加·茂名大喜假日酒店,房间宽大，特别是那个桌子方便，还有两把椅子可以坐着聊天比较舒服。楼下就能免费停车,2021
849,酒店评论-1850,麗枫酒店(茂名电白万达广场店),设施环境卫生还是挺不错的，房价在这种四五线小城市相对高了一点。不过商务出差的话性价比还是不错的。,2021
850,酒店评论-1851,茂名市便捷酒店(高铁火车站店),各方面都可以，热水非常爽，就是没有电蚊香，晚上会有蚊子。周边挺……荒凉的，没什么好玩的。这个价钱我觉得没话说了，nice！,2021
851,酒店评论-1852,凯里亚德酒店(茂名电白万达广场店),地方好找，停车场大，干净卫生,2021
852,酒店评论-1853,茂名御景国际大酒店,不错性价比高舒服,2021
853,酒店评论-1854,茂名御景国际大酒店,回去过清明节定的 前年路过就想着后面要住 高速下来很快就到 酒店还有早茶和海鲜吃 很方便 价格也不贵,2021
854,酒店评论-1855,轻住悦享酒店(茂名高铁南站店),非常好服务好早夕好吃,2021
855,酒店评论-1856,茂名御景国际大酒店,回茂名依然选择这个酒店，服务很周到，环境也很完美，床品呀各方面都很舒服！隔音效果好，特别要给服务员好评，很不错,2021
856,酒店评论-1857,轻住悦享酒店(茂名高铁南站店),非常好酒店早餐好吃停车场很大,2021
857,酒店评论-1858,凯里亚德酒店(茂名电白万达广场店),非常好，环境好，停车场大,2021
858,酒店评论-1859,城市便捷酒店(茂名学府店),过来这边考试，旁边的学校有时候会有点吵，其他时候是安静的。床好大好舒服呀，而且酒店的前台都很好人！！,2021
859,酒店评论-1860,茂名御景国际大酒店,酒店房间挺好，房型面积设备这些可以媲美部分五星，早餐环境一般，餐厅不大，餐食种类还行。总体来说性价比很高，推荐入住。 PS：不能加婴儿床,2021
860,酒店评论-1861,茂名国际大酒店,酒店卫生好！早餐非常丰富，床特别舒服！房间大，服务非常好！停车场大！近地铁口！周边生活非常方便！值得入住！,2021
861,酒店评论-1862,茂名熹龙国际大酒店,出差来这里，酒店环境不错，房间很干净，早餐在西餐厅，品种很多，每天下午有水果或者小饮料，晚上有宵夜送到房间。服务员态度很好，主动帮忙拿行李。周边很繁华，餐厅很多。酒店下楼就是人民广场，可以走步，环境很好，值得来入住的。总之，很满意[Happy],2021
862,酒店评论-1863,茂名诚荟酒店,都很好下次再来,2021
863,酒店评论-1864,Q加·茂名大喜假日酒店,地理位置优越，停车方便，房间舒适干净，前台美女待客热情，非常棒！,2021
864,酒店评论-1865,茂名海豚酒店,靠海滩挺近的，方便，送了停车费，还不错！,2021
865,酒店评论-1866,凯里亚德酒店(茂名电白万达广场店),酒店干净卫生舒适，早餐丰富，前台小姐姐服务热情,2021
866,酒店评论-1867,茂名御景国际大酒店,酒店房间新净舒适，性价比高。,2021
867,酒店评论-1868,茂名海豚酒店,位置好找，停车方便。房间很宽敞，床也很舒服，服务态度挺好，出门也很方便。挺适合我们这种经常性出差的人士！,2021
868,酒店评论-1869,轻住悦享酒店(茂名高铁南站店),很好服务很好早餐很好停车场很大,2021
869,酒店评论-1870,茂名君怡酒店,这个酒店在市中心位置，周边吃饭购物都很方便。每次路过必住，性价比很高。装修很好，房间里面配的物资档次不错，值得推荐,2021
870,酒店评论-1871,轻住悦享酒店(茂名高铁南站店),卫生干净整洁服务很好早餐好吃棒棒哒,2021
871,酒店评论-1872,麗枫酒店(茂名电白万达广场店),服务还可以，定了5间房，房间很大。二楼有餐厅可以用餐，价格合理。有免费停车场很方便。离万达很近，附近的早茶也多。,2021
872,酒店评论-1873,Q加·茂名大喜假日酒店,服务态度超级好啊！而且房间很干净！挺齐全的！性价比来讲！真的挺推荐的！而且蛮安静的！就，好评！很棒！,2021
873,酒店评论-1874,凯里亚德酒店(茂名电白万达广场店),感觉一般般，价格有点高了，所以看时段订房，有时有优惠，你的看法康复疗法克利夫兰，疯狂福利福利福利经典款,2021
874,酒店评论-1875,麗枫酒店(茂名电白万达广场店),酒店的位置赞一个，逛街看电影太方便啦，楼下就是万达广场！房间的设施也还行，前台服务很好，很快就办理完入住了，性价比很高,2021
875,酒店评论-1876,茂名诚荟酒店,安静，舒适，服务到位,2021
876,酒店评论-1877,精途酒店(茂名高铁火车站店),地下停车场很难停，楼上车位经常满位。铁路旁边，火车来往比较嘈杂。附近都是装饰建材，吃饭麻烦，附近只有家茶餐厅吃饭较贵。,2021
877,酒店评论-1878,轻住悦享酒店(茂名高铁南站店),酒店非常干净整洁，地理位置优越,2021
878,酒店评论-1879,柏高酒店(茂名高铁站店),酒店位置特别好，就在茂名高铁站对面。外观高档，房间简约奢华，卫生非常干净。虽然是新装修，但完全无装修的味道。酒店设有自助洗衣房，非常方便。门前有免费大型停车场，非常适合商务人士及自驾游出行。服务人员热情礼貌，非常nice。作为一位经常出差住酒店的人，在茂名我强烈推荐这家酒店。,2021
879,酒店评论-1880,麗枫酒店(茂名电白万达广场店),不错，离电白万达挺近的，出行比较方便，早餐是送到房间的，比较简单的早餐，吃的还可以，房间挺宽敞的，就是晚上睡觉隔音一般,2021
880,酒店评论-1881,茂名熹龙国际大酒店,园景房刚好看到楼下人民广场，风景独好，特意挑了有浴缸的房间，小朋友玩得很开心。第一晚送了红豆沙、第二天又送了面膜，很贴心。唯一一个建议，卫生间有点陈旧了，可以美缝翻新一下，还有就是，整个卫生间都没有一个架子可以放东西，洗澡想放衣服不方便。,2021
881,酒店评论-1882,茂名海豚酒店,前台服务很不错！如果仅是为了到第一滩玩，这个是非常好的选择。,2021
882,酒店评论-1883,维也纳国际酒店(茂名万达广场店),酒店干净，服务好，早餐还可以。附近有万达广场可以走走，旁边有一个吃饭地方，味道还行，不过吃那个鸡有点小贵。,2021
